Unnamed: 0,Volume,Last,Chg,% Chg
Venus Concept Inc. (VERO),38.8M,8.03,5.11,175.03
Antelope Enterprise Holdings Ltd. (AEHL),32.7M,4.94,2.76,126.61
Tivic Health Systems Inc. (TIVC),168.3K,5.42,1.81,50.14
iCoreConnect Inc. (ICCT),19.7M,4.73,1.47,45.09
ENDRA Life Sciences Inc. (NDRA),143.4K,4.79,0.8,20.05
Hub Cyber Security Ltd. (HUBC),2.8M,2.91,0.45,18.21
Jiuzi Holdings Inc. (JZXN),127.2K,4.58,0.69,17.74
Treasure Global Inc. (TGL),3.2M,2.62,0.36,15.93
BeLive Holdings (BLIV),749.1K,3.57,0.47,15.16
Lifecore Biomedical Inc. (LFCR),371.8K,5.99,0.78,14.97
Eason Technology Ltd. ADR (DXF),2.7M,7.38,0.95,14.88
NACCO Industries Inc. Cl A (NC),91.8K,36.68,4.65,14.52
Kura Sushi USA Inc. (KRUS),334.4K,47.29,5.83,14.06
Wellgistics Health Inc. (WGRX),248.5K,4.26,0.44,11.52
China SXT Pharmaceuticals Inc. (SXTC),62.5K,2.77,0.28,11.24
WeRide Inc. ADR (WRD),2.4M,9.8,0.96,10.86
Baiya International Group Inc. (BIYA),221.3K,3.8,0.37,10.79
Nutex Health Inc. (NUTX),145.2K,94.09,9.15,10.77
Simply Good Foods Co. (SMPL),1.0M,36.44,3.25,9.79
Lion Group Holding Ltd. ADR (LGHL),688.0K,3.32,0.29,9.74
Upexi Inc. (UPXI),781.5K,2.39,0.21,9.52
Capri Holdings Ltd. (CPRI),6.7M,13.63,1.15,9.21
Harmony Gold Mining Co. Ltd. ADR (HMY),5.5M,14.16,1.19,9.14
Lianhe Sowell International Group Ltd. (LHSW),2.3M,3.01,0.25,9.12
10x Genomics Inc. (TXG),1.8M,7.75,0.61,8.54
Neurogene Inc. (NGNE),152.6K,7.96,0.63,8.51
FormFactor Inc. (FORM),545.4K,25.14,1.96,8.46
IAMGOLD Corp. (IAG),15.3M,6.3,0.48,8.35
Alpha Cognition Inc. (ACOG),207.6K,4.06,0.31,8.27
Eastman Kodak Co. (KODK),1.1M,5.74,0.44,8.24
Bakkt Holdings Inc. (BKKT),195.6K,7.56,0.56,8.0
Aeva Technologies Inc. (AEVA),334.7K,6.38,0.47,7.95
Sibanye-Stillwater Ltd. ADR (SBSW),13.4M,3.48,0.26,7.92
Rain Enhancement Technologies Holdco Inc. Cl A (RAIN),106.9K,2.26,0.17,7.89
Metalla Royalty & Streaming Ltd. (MTA),252.8K,2.75,0.2,7.84
Aris Mining Corp. (ARMN),1.1M,4.58,0.33,7.77
Coeur Mining Inc. (CDE),9.1M,5.18,0.36,7.59
Aehr Test Systems (AEHR),2.1M,7.28,0.5,7.37
Onto Innovation Inc. (ONTO),886.5K,113.35,7.75,7.34
Expro Group Holdings N.V. (XPRO),854.5K,7.41,0.5,7.24
Trump Media & Technology Group Corp. (DJT),6.1M,17.84,1.18,7.06
Citizens Inc. Cl A (CIA),62.2K,4.01,0.26,6.93
Canadian Solar Inc. (CSIQ),1.1M,7.22,0.47,6.88
BRF S.A. ADR (BRFS),2.3M,3.32,0.21,6.91
Huachen AI Parking Management Technology Holding Co. Ltd. (HCAI),54.0K,7.28,0.46,6.76
AngloGold Ashanti PLC (AU),3.6M,35.39,2.23,6.72
Eldorado Gold Corp. (EGO),1.3M,16.68,1.05,6.72
Olin Corp. (OLN),1.3M,19.16,1.21,6.71
Triple Flag Precious Metals Corp. (TFPM),245.2K,19.54,1.19,6.46
European Wax Center Inc. (EWCZ),330.7K,3.5,0.21,6.38
Everspin Technologies Inc. (MRAM),79.3K,4.68,0.28,6.36
Zhengye Biotechnology Holding Ltd. (ZYBT),55.2K,3.87,0.23,6.32
Encore Capital Group Inc. (ECPG),139.0K,28.84,1.71,6.3
Delta Air Lines Inc. (DAL),13.8M,38.07,2.19,6.1
Endeavour Silver Corp. (EXK),8.2M,3.34,0.19,6.03
EPWK Holdings Ltd. Cl A (EPWK),1.4M,5.1,0.29,6.03
SunRun Inc. (RUN),6.3M,6.0,0.34,6.0
Telos Corp. (TLS),206.1K,2.34,0.13,5.88
Gold Fields Ltd. ADR (GFI),3.2M,21.22,1.18,5.86
Kinross Gold Corp. (KGC),9.7M,12.66,0.7,5.85
Alamos Gold Inc. (AGI),2.3M,25.93,1.43,5.84
Hycroft Mining Holding Corp. (HYMC),79.4K,2.6,0.14,5.69
Intel Corp. (INTC),63.7M,19.16,1.03,5.67
Green Dot Corp. Cl A (GDOT),271.5K,7.08,0.38,5.67
LZ Technology Holdings Ltd. Cl B (LZMH),1.3M,8.65,0.46,5.55
AeroVironment Inc. (AVAV),228.7K,127.68,6.65,5.49
First Majestic Silver Corp. (AG),11.3M,5.52,0.28,5.44
QuickLogic Corp. (QUIK),58.3K,4.67,0.24,5.42
Kornit Digital Ltd. (KRNT),120.4K,16.66,0.84,5.34
QuantumScape Corp. Cl A (QS),4.7M,3.66,0.18,5.33
Redwire Corp. (RDW),503.3K,8.12,0.41,5.32
Bionano Genomics Inc. (BNGO),94.5K,2.98,0.15,5.31
Wolfspeed Inc. (WOLF),9.7M,2.3,0.12,5.28
Compania de Minas Buenaventura S.A. ADR (BVN),712.9K,13.62,0.68,5.26
Arm Holdings PLC ADR (ARM),3.6M,90.3,4.47,5.21
Vertical Aerospace Ltd. (EVTL),130.7K,3.03,0.15,5.21
Pan American Silver Corp. (PAAS),2.7M,22.84,1.12,5.16
Goodyear Tire & Rubber Co. (GT),3.1M,8.91,0.43,5.13
Orla Mining Ltd. (ORLA),609.0K,8.72,0.42,5.13
Mingteng International Corp. Inc. (MTEN),65.6K,4.31,0.21,5.12
Shutterstock Inc. (SSTK),172.5K,15.3,0.74,5.12
Bloomin' Brands Inc. (BLMN),1.2M,6.58,0.32,5.11
Vishay Intertechnology Inc. (VSH),1.9M,11.11,0.54,5.11
Vera Therapeutics Inc. (VERA),224.4K,19.82,0.96,5.09
Hecla Mining Co. (HL),15.7M,4.95,0.24,5.08
Camtek Ltd. (CAMT),245.8K,54.97,2.65,5.06
NovaGold Resources Inc. (NG),1.4M,2.4,0.12,5.04
REE Automotive Ltd. (REE),101.1K,2.51,0.12,5.02
908 Devices Inc. (MASS),84.7K,3.81,0.18,4.96
Ameresco Inc. Cl A (AMRC),234.4K,9.74,0.46,4.96
Amprius Technologies Inc. (AMPX),1.2M,2.22,0.1,4.95
Perpetua Resources Corp. (PPTA),535.9K,10.0,0.47,4.93
NeOnc Technologies Holdings Inc. (NTHI),69.4K,10.1,0.47,4.89
Workiva Inc. Cl A (WK),443.5K,64.89,2.98,4.81
U.S. Gold Corp. (USAU),142.6K,8.29,0.38,4.79
Tesla Inc. (TSLA),76.3M,232.46,10.6,4.78
Pangaea Logistics Solutions Ltd. (PANL),141.3K,4.18,0.19,4.76
MACOM Technology Solutions Holdings Inc. (MTSI),574.3K,91.8,4.16,4.74
Advanced Micro Devices Inc. (AMD),30.4M,81.91,3.7,4.73
New Gold Inc. (NGD),12.8M,3.12,0.14,4.7
